{
  "$id": "https://posthog-impact.local/schemas/raw_pages.schema.json",
  "$schema": "https://json-schema.org/draft/2020-12/schema",
  "additionalProperties": false,
  "properties": {
    "attempt_count": {
      "arrow_type": "int64",
      "type": [
        "integer",
        "null"
      ]
    },
    "cursor": {
      "arrow_type": "string",
      "type": [
        "string",
        "null"
      ]
    },
    "elapsed_seconds": {
      "arrow_type": "double",
      "type": [
        "number",
        "null"
      ]
    },
    "entity": {
      "arrow_type": "string",
      "type": [
        "string",
        "null"
      ]
    },
    "error": {
      "arrow_type": "string",
      "type": [
        "string",
        "null"
      ]
    },
    "extracted_at": {
      "arrow_type": "string",
      "type": [
        "string",
        "null"
      ]
    },
    "extractor_version": {
      "arrow_type": "string",
      "type": [
        "string",
        "null"
      ]
    },
    "http_status": {
      "arrow_type": "int64",
      "type": [
        "integer",
        "null"
      ]
    },
    "page_index": {
      "arrow_type": "int64",
      "type": [
        "integer",
        "null"
      ]
    },
    "query_name": {
      "arrow_type": "string",
      "type": [
        "string",
        "null"
      ]
    },
    "rate_limit_cost": {
      "arrow_type": "int64",
      "type": [
        "integer",
        "null"
      ]
    },
    "rate_limit_remaining": {
      "arrow_type": "int64",
      "type": [
        "integer",
        "null"
      ]
    },
    "request_hash": {
      "arrow_type": "string",
      "type": [
        "string",
        "null"
      ]
    },
    "response_path": {
      "arrow_type": "string",
      "type": [
        "string",
        "null"
      ]
    },
    "response_sha256": {
      "arrow_type": "string",
      "type": [
        "string",
        "null"
      ]
    },
    "shard": {
      "arrow_type": "string",
      "type": [
        "string",
        "null"
      ]
    },
    "status": {
      "arrow_type": "string",
      "type": [
        "string",
        "null"
      ]
    },
    "terminal_reason": {
      "arrow_type": "null",
      "type": [
        "string",
        "null"
      ]
    }
  },
  "title": "raw_pages",
  "type": "object",
  "x-pipeline-version": "1.0.0",
  "x-schema-version": "1.0.0"
}
