[
  {
    "attempt_count": 1,
    "cursor": null,
    "elapsed_seconds": 0.604,
    "entity": "discovery",
    "error": null,
    "extracted_at": "2026-08-17T03:09:44.323394Z",
    "extractor_version": "1.0.0",
    "http_status": 200,
    "page_index": 0,
    "query_name": "discover:created",
    "rate_limit_cost": 1,
    "rate_limit_remaining": 4840,
    "request_hash": "d15d77e982e3a24ff512095fdc4110da1f6feec32127620d9a1df8fd911bc222",
    "response_path": "data/raw/github/discovery/_responses/d15d77e982e3a24ff512095fdc4110da1f6feec32127620d9a1df8fd911bc222.json.gz",
    "response_sha256": "8630f863296a3d0dfbbcd2993689a532e35216e0a2ba0c87137ca29dbbce11c6",
    "shard": "created_2026-05-19_2026-05-21",
    "status": "ok",
    "terminal_reason": null
  },
  {
    "attempt_count": 1,
    "cursor": "Y3Vyc29yOjEwMA==",
    "elapsed_seconds": 0.565,
    "entity": "discovery",
    "error": null,
    "extracted_at": "2026-08-17T03:09:44.893017Z",
    "extractor_version": "1.0.0",
    "http_status": 200,
    "page_index": 1,
    "query_name": "discover:created",
    "rate_limit_cost": 1,
    "rate_limit_remaining": 4839,
    "request_hash": "e54cb1fa7065549392f6a2f1eb10e385e0cdad67db7a7b267d63162bfd5570de",
    "response_path": "data/raw/github/discovery/_responses/e54cb1fa7065549392f6a2f1eb10e385e0cdad67db7a7b267d63162bfd5570de.json.gz",
    "response_sha256": "636dbc48d630b3828d3fc401046a6fe3c98b4451f0c82a6f5bc062a3d4299ef9",
    "shard": "created_2026-05-19_2026-05-21",
    "status": "ok",
    "terminal_reason": null
  },
  {
    "attempt_count": 1,
    "cursor": "Y3Vyc29yOjIwMA==",
    "elapsed_seconds": 1.203,
    "entity": "discovery",
    "error": null,
    "extracted_at": "2026-08-17T03:09:46.101642Z",
    "extractor_version": "1.0.0",
    "http_status": 200,
    "page_index": 2,
    "query_name": "discover:created",
    "rate_limit_cost": 1,
    "rate_limit_remaining": 4838,
    "request_hash": "41bad9acbbdc6b7129f41a9cddf70090cc495a4349daceed296942f5224ae973",
    "response_path": "data/raw/github/discovery/_responses/41bad9acbbdc6b7129f41a9cddf70090cc495a4349daceed296942f5224ae973.json.gz",
    "response_sha256": "bf5621eab13e2c1126cc9eed17fc86cc9cb9afad926df851100afeaaed7eb9a9",
    "shard": "created_2026-05-19_2026-05-21",
    "status": "ok",
    "terminal_reason": null
  },
  {
    "attempt_count": 1,
    "cursor": "Y3Vyc29yOjMwMA==",
    "elapsed_seconds": 0.575,
    "entity": "discovery",
    "error": null,
    "extracted_at": "2026-08-17T03:09:46.680029Z",
    "extractor_version": "1.0.0",
    "http_status": 200,
    "page_index": 3,
    "query_name": "discover:created",
    "rate_limit_cost": 1,
    "rate_limit_remaining": 4837,
    "request_hash": "dce3cd308b8b785f20093e46fad27199ed7c57a2c6b3fbadffc273f8701a3483",
    "response_path": "data/raw/github/discovery/_responses/dce3cd308b8b785f20093e46fad27199ed7c57a2c6b3fbadffc273f8701a3483.json.gz",
    "response_sha256": "bd63ba1b3e2c5d7f98e107296890f623ee37da150ebe79b482dd2eec4654dc20",
    "shard": "created_2026-05-19_2026-05-21",
    "status": "ok",
    "terminal_reason": null
  },
  {
    "attempt_count": 1,
    "cursor": "Y3Vyc29yOjQwMA==",
    "elapsed_seconds": 0.642,
    "entity": "discovery",
    "error": null,
    "extracted_at": "2026-08-17T03:09:47.328242Z",
    "extractor_version": "1.0.0",
    "http_status": 200,
    "page_index": 4,
    "query_name": "discover:created",
    "rate_limit_cost": 1,
    "rate_limit_remaining": 4836,
    "request_hash": "75d51145a6f429bf1f12472d03da5640e0f9db66f20cb5c8966541a4fd3813b7",
    "response_path": "data/raw/github/discovery/_responses/75d51145a6f429bf1f12472d03da5640e0f9db66f20cb5c8966541a4fd3813b7.json.gz",
    "response_sha256": "8466252caa1daf2858a9a173935bffd13eb410651d65f50c563ae8523a606aa5",
    "shard": "created_2026-05-19_2026-05-21",
    "status": "ok",
    "terminal_reason": null
  },
  {
    "attempt_count": 1,
    "cursor": "Y3Vyc29yOjUwMA==",
    "elapsed_seconds": 0.476,
    "entity": "discovery",
    "error": null,
    "extracted_at": "2026-08-17T03:09:47.810330Z",
    "extractor_version": "1.0.0",
    "http_status": 200,
    "page_index": 5,
    "query_name": "discover:created",
    "rate_limit_cost": 1,
    "rate_limit_remaining": 4835,
    "request_hash": "31066a4970ba7a2d3149f148e0553d8cbf3d5d8e149e8e096d8dd33bea57b15f",
    "response_path": "data/raw/github/discovery/_responses/31066a4970ba7a2d3149f148e0553d8cbf3d5d8e149e8e096d8dd33bea57b15f.json.gz",
    "response_sha256": "f3cc8f0082ccad32931f836c45c1ba6c382c7732c12ff27a4f4e256a813d93fe",
    "shard": "created_2026-05-19_2026-05-21",
    "status": "ok",
    "terminal_reason": null
  },
  {
    "attempt_count": 1,
    "cursor": null,
    "elapsed_seconds": 0.669,
    "entity": "discovery",
    "error": null,
    "extracted_at": "2026-08-17T03:09:48.502286Z",
    "extractor_version": "1.0.0",
    "http_status": 200,
    "page_index": 0,
    "query_name": "discover:created",
    "rate_limit_cost": 1,
    "rate_limit_remaining": 4834,
    "request_hash": "16ea7bb3ceee871ed5420bb4f9036d91090b551823ee8b17065efd9c3386c222",
    "response_path": "data/raw/github/discovery/_responses/16ea7bb3ceee871ed5420bb4f9036d91090b551823ee8b17065efd9c3386c222.json.gz",
    "response_sha256": "97c1c89b12d406680f9c6ba4aa95891fb0f65b37d34e7298d8000811e8adb7ae",
    "shard": "created_2026-05-22_2026-05-24",
    "status": "ok",
    "terminal_reason": null
  },
  {
    "attempt_count": 1,
    "cursor": "Y3Vyc29yOjEwMA==",
    "elapsed_seconds": 1.013,
    "entity": "discovery",
    "error": null,
    "extracted_at": "2026-08-17T03:09:49.522769Z",
    "extractor_version": "1.0.0",
    "http_status": 200,
    "page_index": 1,
    "query_name": "discover:created",
    "rate_limit_cost": 1,
    "rate_limit_remaining": 4833,
    "request_hash": "8212f0b487cbf5f58adeeb4981d732b5c1f1b452f6684934463c96899a4643fd",
    "response_path": "data/raw/github/discovery/_responses/8212f0b487cbf5f58adeeb4981d732b5c1f1b452f6684934463c96899a4643fd.json.gz",
    "response_sha256": "97d07e5c67bc370f0b59d52f2b39bc4ce347e5d1b36a06feddbe6d7a1cc4e320",
    "shard": "created_2026-05-22_2026-05-24",
    "status": "ok",
    "terminal_reason": null
  },
  {
    "attempt_count": 1,
    "cursor": "Y3Vyc29yOjIwMA==",
    "elapsed_seconds": 0.536,
    "entity": "discovery",
    "error": null,
    "extracted_at": "2026-08-17T03:09:50.094116Z",
    "extractor_version": "1.0.0",
    "http_status": 200,
    "page_index": 2,
    "query_name": "discover:created",
    "rate_limit_cost": 1,
    "rate_limit_remaining": 4832,
    "request_hash": "d56cfcd2628bdb3c31e85a48201b0b39aad6d53d32d0a01664e98953f458cbe8",
    "response_path": "data/raw/github/discovery/_responses/d56cfcd2628bdb3c31e85a48201b0b39aad6d53d32d0a01664e98953f458cbe8.json.gz",
    "response_sha256": "d5f9d29217684d3aa41508a088c1397f4b88a95c13a8d5df174ccf2f6428d7f3",
    "shard": "created_2026-05-22_2026-05-24",
    "status": "ok",
    "terminal_reason": null
  },
  {
    "attempt_count": 1,
    "cursor": null,
    "elapsed_seconds": 0.85,
    "entity": "discovery",
    "error": null,
    "extracted_at": "2026-08-17T03:09:50.962606Z",
    "extractor_version": "1.0.0",
    "http_status": 200,
    "page_index": 0,
    "query_name": "discover:created",
    "rate_limit_cost": 1,
    "rate_limit_remaining": 4831,
    "request_hash": "abc4556f69d4a04a5adf7d1c2c579de6b9a4f2b09e42fe20d3d9aec1a43411c4",
    "response_path": "data/raw/github/discovery/_responses/abc4556f69d4a04a5adf7d1c2c579de6b9a4f2b09e42fe20d3d9aec1a43411c4.json.gz",
    "response_sha256": "51dcca2d040e647bdaaf100ad7b744f63da3bd78b94a9b69805083557c50f7d6",
    "shard": "created_2026-05-25_2026-05-27",
    "status": "ok",
    "terminal_reason": null
  },
  {
    "attempt_count": 1,
    "cursor": "Y3Vyc29yOjEwMA==",
    "elapsed_seconds": 0.889,
    "entity": "discovery",
    "error": null,
    "extracted_at": "2026-08-17T03:09:51.858577Z",
    "extractor_version": "1.0.0",
    "http_status": 200,
    "page_index": 1,
    "query_name": "discover:created",
    "rate_limit_cost": 1,
    "rate_limit_remaining": 4830,
    "request_hash": "11b96e721c185ed81d67709fefd13fca0b1ddf4b04d4c96355896707d83cec07",
    "response_path": "data/raw/github/discovery/_responses/11b96e721c185ed81d67709fefd13fca0b1ddf4b04d4c96355896707d83cec07.json.gz",
    "response_sha256": "2c97d7d83e5e8e9547d513422b7021678a01ba8e1e2fc19e31611efd26cdf743",
    "shard": "created_2026-05-25_2026-05-27",
    "status": "ok",
    "terminal_reason": null
  },
  {
    "attempt_count": 1,
    "cursor": "Y3Vyc29yOjIwMA==",
    "elapsed_seconds": 0.657,
    "entity": "discovery",
    "error": null,
    "extracted_at": "2026-08-17T03:09:52.522456Z",
    "extractor_version": "1.0.0",
    "http_status": 200,
    "page_index": 2,
    "query_name": "discover:created",
    "rate_limit_cost": 1,
    "rate_limit_remaining": 4829,
    "request_hash": "793b8ac229956155ad335398efae1e9069a0fc24fb872e724c2b51baf3e5eced",
    "response_path": "data/raw/github/discovery/_responses/793b8ac229956155ad335398efae1e9069a0fc24fb872e724c2b51baf3e5eced.json.gz",
    "response_sha256": "0be02ba3b15ccef6118f7122f305d34b4703e5f53ef8b5803a3a5cc312da6a35",
    "shard": "created_2026-05-25_2026-05-27",
    "status": "ok",
    "terminal_reason": null
  },
  {
    "attempt_count": 1,
    "cursor": "Y3Vyc29yOjMwMA==",
    "elapsed_seconds": 0.625,
    "entity": "discovery",
    "error": null,
    "extracted_at": "2026-08-17T03:09:53.153686Z",
    "extractor_version": "1.0.0",
    "http_status": 200,
    "page_index": 3,
    "query_name": "discover:created",
    "rate_limit_cost": 1,
    "rate_limit_remaining": 4828,
    "request_hash": "960a173ee45375a18468924418579d396eb4af0b9a6f71ee40ca7fbdc78d12c1",
    "response_path": "data/raw/github/discovery/_responses/960a173ee45375a18468924418579d396eb4af0b9a6f71ee40ca7fbdc78d12c1.json.gz",
    "response_sha256": "d3ce4bde5c758bc42f32d01723561b653bd7dd4f91a22e4c8c0f03cb61c8719e",